{
  "$schema": "https://json-schema.org/draft/2020-12/schema",
  "$id": "https://example.com/schemas/install-profiles.schema.json",
  "title": "Install Profiles",
  "type": "object",
  "additionalProperties": false,
  "required": [
    "version",
    "description",
    "profiles"
  ],
  "properties": {
    "version": {
      "type": "integer",
      "minimum": 1
    },
    "description": {
      "type": "string",
      "minLength": 1
    },
    "profiles": {
      "type": "array",
      "minItems": 1,
      "items": {
        "type": "object",
        "additionalProperties": false,
        "required": [
          "id",
          "summary",
          "components"
        ],
        "properties": {
          "id": {
            "type": "string",
            "pattern": "^[a-z0-9][a-z0-9-]*$"
          },
          "summary": {
            "type": "string",
            "minLength": 1
          },
          "components": {
            "type": "array",
            "minItems": 1,
            "items": {
              "type": "string",
              "pattern": "^(baseline|engine|domain|capability):[a-z0-9][a-z0-9-]*$"
            },
            "uniqueItems": true
          },
          "contexts": {
            "type": "array",
            "items": {
              "type": "string",
              "pattern": "^[a-z0-9][a-z0-9-]*$"
            },
            "uniqueItems": true
          },
          "notes": {
            "type": "string"
          }
        }
      }
    },
    "policy": {
      "type": "object",
      "additionalProperties": false,
      "properties": {
        "default_active_engine_count": {
          "type": "integer",
          "minimum": 0
        },
        "notes": {
          "type": "array",
          "items": {
            "type": "string"
          }
        }
      }
    }
  }
}
